{"attestation_version":"1.0","bundle_sha256":"95dd84bb5c4e98cb8b5f275466a419d9731634716c54500e20af79df4d4d4ea3","core_version":"0.3.0","created_utc":"2026-05-27T11:07:05Z","manifest_sha256":"0000000000000000000000000000000000000000000000000000000000000000","output_sha256":"e00586e9de46110f4c8cc59cba4fc97902f89433018a6d75a2c979e2fedad8d7","ruleset_id":"ruleset.cuc_harness.structured_delta.v1"}