{"attestation_version":"1.0","bundle_sha256":"8686ce49bf1011690be1f95d338672f9c4b5445c4ae92a994b78a70f8e6760fc","core_version":"0.3.0","created_utc":"2026-05-27T10:39:37Z","manifest_sha256":"0000000000000000000000000000000000000000000000000000000000000000","output_sha256":"877de9b0d0bedf9d3262a04d92b36fbd92af75fa695c0f6e6f409fe8d8856463","ruleset_id":"ruleset.cuc_harness.structured_delta.v1"}