{"attestation_version":"1.0","bundle_sha256":"6c75f61a39cc3870524facede20e9797acb6e44abcf7dc310bdda33f2471e1d3","core_version":"0.3.0","created_utc":"2026-05-27T10:34:23Z","manifest_sha256":"0000000000000000000000000000000000000000000000000000000000000000","output_sha256":"0eec7c8b75b3f296cad81e91e147e2fc31299420ed2f2fc9b9230dbb00d56ee1","ruleset_id":"ruleset.cuc_harness.structured_delta.v1"}