{"attestation_version":"1.0","bundle_sha256":"f59bb947a47704349bcc7f0c64a9597c92c124143650d56e5416dfc08415f566","core_version":"0.3.0","created_utc":"2026-06-04T04:59:19Z","manifest_sha256":"03882175de86507a0c830e2a2da68d628cb633ae666370677b82ec55e8c67e9e","output_sha256":"2c873500c3341121c92e4aa40e0909f1f63f8beb2a3a8e77879afbbbb2f5bf84","ruleset_id":"ruleset.cuc_harness.structured_delta.v1"}