{"attestation_version":"1.0","bundle_sha256":"b8bc38d0530458df0eac70629c2529908f2b825807300da438ea52af9440aac8","core_version":"0.3.0","created_utc":"2026-05-27T11:07:05Z","manifest_sha256":"0000000000000000000000000000000000000000000000000000000000000000","output_sha256":"83b5f4196b1c4cd3648d312949df85ae0e60c6816ce07892320b40c9237ecb72","ruleset_id":"ruleset.cuc_harness.structured_delta.v1"}