{"attestation_version":"1.0","bundle_sha256":"a7721ed2dcd6bd3c86b08baf1c5849fe26182ace1d5323180240f4eb7a118a51","core_version":"0.3.0","created_utc":"2026-05-27T11:07:05Z","manifest_sha256":"0000000000000000000000000000000000000000000000000000000000000000","output_sha256":"aea41f5eca071caa37b3b14ef715cdd2971033b5f0eba1dfe728ed377dbbfbd4","ruleset_id":"ruleset.cuc_harness.structured_delta.v1"}