{"attestation_version":"1.0","bundle_sha256":"0b348c74a45e2388aa3e8112c65fb580807d526f31e55ec59360716f40051388","core_version":"0.3.0","created_utc":"2026-05-27T11:07:05Z","manifest_sha256":"0000000000000000000000000000000000000000000000000000000000000000","output_sha256":"7e9f2a96e4e33bbd957779186370a310147b24eacaa1fca08456c56dfeea78b5","ruleset_id":"ruleset.cuc_harness.structured_delta.v1"}