{"attestation_version":"1.0","bundle_sha256":"a6c6c52b7a81aa38827ab626746416b069afa1645e45b7d8d3be2c2a8387983d","core_version":"0.3.0","created_utc":"2026-05-27T10:33:19Z","manifest_sha256":"0000000000000000000000000000000000000000000000000000000000000000","output_sha256":"49a9c38159c4c36bbe934a33a0dcfc3eb761d73116020698d4589ee0c37b65bf","ruleset_id":"ruleset.cuc_harness.structured_delta.v1"}