{"attestation_version":"1.0","bundle_sha256":"6e3ce3a0f2b39ad3999342699e64d36c28cf51816a46c5074a68945679ab1dad","core_version":"0.3.0","created_utc":"2026-05-27T10:37:16Z","manifest_sha256":"0000000000000000000000000000000000000000000000000000000000000000","output_sha256":"9b3cc8bf5a18751a21494ed609ab377853c9b869e660850596efcce4248927da","ruleset_id":"ruleset.cuc_harness.structured_delta.v1"}