{"attestation_version":"1.0","bundle_sha256":"9ecd3f4a13b46921b94e6512e8cf7cc779c0db96336f67840b5edcb3ca903ecc","core_version":"0.3.0","created_utc":"2026-05-27T10:34:04Z","manifest_sha256":"0000000000000000000000000000000000000000000000000000000000000000","output_sha256":"48ff1a32a38d10c04a77d73a7e57179b1a76952c709eae10a236a952fb669de9","ruleset_id":"ruleset.cuc_harness.structured_delta.v1"}