{"attestation_version":"1.0","bundle_sha256":"e241c6d1342ef5ba16f07de56d041c58f27f1808e612dd24924c8892322c3ec6","core_version":"0.3.0","created_utc":"2026-05-27T11:07:05Z","manifest_sha256":"0000000000000000000000000000000000000000000000000000000000000000","output_sha256":"1b87c8d54374b5c83a6eda36c5ade073d323d9ab4f00464da29280ebb6a8d10f","ruleset_id":"ruleset.cuc_harness.structured_delta.v1"}