{"attestation_version":"1.0","bundle_sha256":"3adac3b34ebb4d113d0e7cbee807e1741e07a9560855b25a6bb39dbd693426d9","core_version":"0.3.0","created_utc":"2026-05-27T11:07:05Z","manifest_sha256":"0000000000000000000000000000000000000000000000000000000000000000","output_sha256":"4e17f7ed1eb6fbfa4688c7d72129fb1db4b3bf0f6d1ab3bef7d1ca8187973a9a","ruleset_id":"ruleset.cuc_harness.structured_delta.v1"}