{"attestation_version":"1.0","bundle_sha256":"743c0068ac587b47487a6b4db99c399642bee68a3d5f793d15425a2d47b4664a","core_version":"0.3.0","created_utc":"2026-05-27T10:35:05Z","manifest_sha256":"0000000000000000000000000000000000000000000000000000000000000000","output_sha256":"1c2be01aaccaac8ee4e51a528c4974aed0f458dc1fa97429114802c673f99649","ruleset_id":"ruleset.cuc_harness.structured_delta.v1"}