{"attestation_version":"1.0","bundle_sha256":"29691a5b419876e51a5b6330acee2f6a7bb2974ccafd56e9be0b179da5ace7a9","core_version":"0.3.0","created_utc":"2026-05-27T10:32:56Z","manifest_sha256":"0000000000000000000000000000000000000000000000000000000000000000","output_sha256":"6b64e4de655d1c303684836df7c7dad16bfbcd7c44bb3d5f1014080002ffd776","ruleset_id":"ruleset.cuc_harness.structured_delta.v1"}