{"attestation_version":"1.0","bundle_sha256":"9e73f2bd74689968b3042309c758bd62872baf1bcb67a6ea3cd7bffcc1962556","core_version":"0.3.0","created_utc":"2026-05-27T11:07:05Z","manifest_sha256":"0000000000000000000000000000000000000000000000000000000000000000","output_sha256":"4f5ef588c40b08450fca3ccd730c200847a5fc79694c1ad04a807f1709c3d153","ruleset_id":"ruleset.cuc_harness.structured_delta.v1"}