{"attestation_version":"1.0","bundle_sha256":"4ee2fed4e9e14632d12164d7bd08d1d06c49379bb3a8708d7a79647586cbbfe8","core_version":"0.3.0","created_utc":"2026-05-27T10:36:08Z","manifest_sha256":"0000000000000000000000000000000000000000000000000000000000000000","output_sha256":"a511b4c37e25b41e8ed1a25e494aed741b26ed924e19c8f50ed54398dbb52a43","ruleset_id":"ruleset.cuc_harness.structured_delta.v1"}