{"attestation_version":"1.0","bundle_sha256":"9ff0427e75ffa416da0bf7606f99f66ca87d7e191ba0fb29adb8e144d5557f4b","core_version":"0.3.0","created_utc":"2026-05-27T10:33:40Z","manifest_sha256":"0000000000000000000000000000000000000000000000000000000000000000","output_sha256":"bd00f30597b0abcf1fe6e0699f60552e4f0531a33cdac7d72d361016083b15ea","ruleset_id":"ruleset.cuc_harness.structured_delta.v1"}