{"attestation_version":"1.0","bundle_sha256":"221f219f71385c6460ea1b18d1ce061ab0f048e3352942f7855ec7f7e006d9f2","core_version":"0.3.0","created_utc":"2026-05-27T11:07:05Z","manifest_sha256":"0000000000000000000000000000000000000000000000000000000000000000","output_sha256":"610a3c1dfb170c8a2a9b5a419727db4c59637ae5b49444439eb0164639fd8cca","ruleset_id":"ruleset.cuc_harness.structured_delta.v1"}